{
  "id": "test.calibration.walking-character",
  "name": "Calibration Walking Character Sprite Sheet (canonical source for all six targets)",
  "description": "Synthetic clean-room geometric calibration sprite sheet for RPG Maker 2000 and 2003 CharSet verification",
  "type": "charset",
  "format": "image/x-rgba-raw; 32-bit",
  "dimensions": {
    "width": 288,
    "height": 256
  },
  "grid": {
    "characters_x": 4,
    "characters_y": 2,
    "frame_width": 24,
    "frame_height": 32,
    "columns_per_character": 3,
    "rows_per_character": 4
  },
  "directions": {
    "row_0": "UP",
    "row_1": "RIGHT",
    "row_2": "DOWN",
    "row_3": "LEFT"
  },
  "animation_columns": {
    "col_0": "STEP_LEFT",
    "col_1": "IDLE",
    "col_2": "STEP_RIGHT"
  },
  "test_only": true,
  "license": "CC0-1.0",
  "file": "registry/assets/test_calibration_walking_character.rgba",
  "master_png": "registry/assets/test_calibration_walking_character_master.png",
  "sha256": "78ad9a170ac0ba06eb4756f9c9c19923e754e82c22025dab7dfbc46de5c1b790"
}